"C","25","25","イヌボウザキイッカイノホームページ","犬吠埼一介のホームページ","「さながら元素のように僕らは出会った」

軽快なレトロフューチャーを感じさせるスペオペです。
犬吠埼ナイン構想、四番目の章作品となります。新刊、
２００円。「そのたま！」、「耳と尻尾の狭間にて」と
三冊セットで５００円です。この機会に、ぜひお楽しみ
いただければ大変幸いです。：）","","http://inubousaki-ikkai.info/","","小説","エンタメ・大衆小説"
"C","26","26","アコード","AKKORD","文字書きばかり４．５人のユニット。エンタメはじめ、ライトノベル、ロマンス、メフィストと傾向は多岐。音楽用語をテーマにしたメインメンバー短編集「AKKORD 02」発行予定。","遠見伊鶴、高広、斜線堂侑李、瀧沢諒","http://akkord2012.tumblr.com/","@Akkord2012","小説","エンタメ・大衆小説"
"C","27","27","マチアカリ","まちあかり","女性4人による「まちあかり」。5回目の出店です。手軽に読める短編小説を中心に書いています。たまに詩もあります。表紙が可愛いと評判です。中身もがんばります。","","","","小説","エンタメ・大衆小説"
"C","28","28","ダークンサイト","DA☆RK'n SIGHT","現代/SF/ファンタジー、長編/中編/短編/ショートショートと、ジャンル・スタイル問わずに脈絡なく何でも書いています。競馬擬人化小説「中山12R４歳上1000万下ダ1200」、ポーカーを題材にした「ＢＢＢ！」等、現在はバクチ系の作品多め。","ＤＡ☆","http://www1.plala.or.jp/d_site/","","小説","エンタメ・大衆小説"
"C","29","29","カシキンコ","菓子金粉","即売会二度目の参加、マルチクリエイトサークル、菓子金粉です。
サークル名が菓子金庫から菓子金粉に変わりました。

既刊「Finder」と、コピ本「風妖精」に手を加えたもの、新しくコピ本（多分風妖精の2）を持っていきます。
他にも持っていくかも

試し読みだけでも気軽にしていってくださいな","野村草太（早乙女シン）","http://seastation.blog.fc2.com/","@saotomesynn","小説","エンタメ・大衆小説"
"C","30","30","シュウスイ","秋水","人と人との絆や喪失などをお話のテーマとして、現代、和風、洋風ファンタジーまで浅く広く。少し不思議な現代ものや、クラシカルな洋風ファンタジーなどあります。スチームパンク風、警察コンビものな新刊があるかも。","志水了、あき乃","http://autumnwater.org/","@rssyubinbou","小説","エンタメ・大衆小説"
"C","31","31","オニャンニャンバレット","ONYANYAN‐bulett","清純派です。

皆とおにゃんにゃんしたいです。

初参加です。

ポケモンＸＹ買いました？

僕は買ってません。

今回のテーマは「時間もの」

合言葉は「皆とおにゃんにゃん」

僕たちのことを嫌いになっても、自分の性欲は否定しないでください。","bullet(社長)、おにゃんにゃん（やヴぁい人）、‐（見た目ＤＱＮ）","","@bulletONYAN","小説","エンタメ・大衆小説"
"C","32","32","ホンキィトンク","ＨＯＮＫＹ−ＴＯＮＫ","今度の長編『猟犬の残効』は社会派ド真ん中のハードボイルドサスペンス。
時は2020年代、ニューヨーク。とある集団失踪をめぐる事件に遭遇したジャーナリスト、ダイアン・デイ。事件に関わった後、彼女の周囲に不可思議なことが起こり始めていく――
大きな渦を描く事件簿。乞うご期待。","三日月理音","http://uxorimperatoria.blog54.fc2.com/","@Lio_Mikazuki","小説","エンタメ・大衆小説"
"C","33","33","ショウジョコナゴナ","少女こなごな","初参加です。
女の子のきらきらととげとげを書いています。一生セーラー服を着ていたい、夢の国から帰りたくない、あの子のかさぶたを剥がしたい、そんなあなたに。","紗良　秋山ヨキ","http://nanos.jp/srxxxsr/","@srxxxgrgr","小説","エンタメ・大衆小説"
"C","34","34","ゴツゴウシュギシャ","御都合主義社","「名前よりは真面目です(迫真)」

都内某Ｔ大学(not東京)の有志学生が立ち上げたサークルです。

ジャンルはエンタメだけでなく、しっかりした純文や、軽～いライトな小説まで様々です。立ち読み、雑談、冷やかし、なんでも結構です。ぜひブース前まで来て、一言二言お話ししましょう！","","","@gotsugou_syugi","小説","エンタメ・大衆小説"
"C","35","35","デイジーチェーンセイサクイインカイ","DAISY CHAIN 製作委員会","デザイン・美術系のスタッフが贈る異色のエンターテイメント文藝誌。プロデザイナーの手がける装丁、レイアウトは必見です。今号より短編集としてリニューアルします。実力派新人の参加も決定！　名作揃いのバックナンバーも取りそろえています。ぜひ、お立ち寄りを！","瑞穂はじめ、彩世梨緒、宮野繭子、他","http://www.mogra.co.jp/daisy/","@daisy_label","小説","エンタメ・大衆小説"
"C","36","36","アブレ","aBre","1年ぶりの再登場、（多分）エンタメ集団のaBreです。第9号です。二桁まであと1号です。買ってください。買うと言えば、今回の冊子のテーマが『買う』なんですよ。買うって言ったら何想像します？　酒？　女？　本？　aBre？　何でもいいんですけど、メンバーそれぞれ何買うか考えて書いてます、どうぞよろしく。","秋梨，牛濱知昭，背川有人，垂崎依都，間宮篤，ゆるぎ俊哉","http://d.hatena.ne.jp/abredit/","@aBredit","小説","エンタメ・大衆小説"
"C","37","37","ダイキチエクセレント","大吉エクセレント","三人合わせれば文殊の知恵ということで頑張っております。","入地均　大室政昭　吉田岳史","","","小説","エンタメ・大衆小説"
"C","38","38","ショウセツドウジンシモン","小説同人誌ｍｏｎ","大阪発の小説同人誌です。１０月に発行したＶｏｌ．３を携えて東京会場に初参加！　ゲスト作家が多い今号は、変態小説からロリコン青春小説、ハードボイルド任侠小説まで内容は多彩です。またｍｏｎでは毎号ゲスト作家の参加を募集中。ジャンル・経験不問。興味のある方はお気軽にお声かけください。(希望多数の場合抽選)","飯田未和、曽口十土、原田嘉彦ほか","http://doujin-mon.blog.eonet.jp/","@doujinmon","小説","エンタメ・大衆小説"
"C","39","39","クマガヤザツブンクミアイ","熊谷雑文組合","SF、ファンタジー、青春、歴史、エログロなどなどさまざまなジャンルを好き勝手書き殴るごった煮創作サークル。ドギツイ個性の組合員達による統一感などまるで考えない創作物の数々をお楽しみ下さい。","小竹大樹　萌兄　朽葉　加糖コージ　環俊次　善浪栄一","http://weeklymoblog.blog21.fc2.com/","@zennami","小説","エンタメ・大衆小説"
"C","40","40","ハスノウテナ","蓮の台","「表現力のあるキチガイは、ないキチガイを救うことができるわ、一緒に本を出しましょう」
私は、遠い場所でひとりになってしまう、ありすちゃんと約束しました。
澄んだ海と抜けるような空なんか毎日眺めていたら、死んでしまう！
どうして死んじゃいけないの？
・・・私が、あとを追いたくなるから、です。","櫻ヰありす　白木蓮","","","小説","エンタメ・大衆小説"
"C","41","41","シティライツ","City Lights","色んな種類の小説あります。魔物妖怪娘マニアな青年の冒険譚（ライトvore）・天才野球少年が男子ソフト部に入ったら的な作品・誤解されがちな「ピエロ」の印象改善を目論む本格道化師モノ……ピアス穴あけ体験談本も。第一弾「ロブ・センタータン・トラガス」、怖いもの見たさにどうぞ。","Svea（すべあ）","","@PhilipSvea","小説","エンタメ・大衆小説"
"C","42","42","トリアトリエ","トリアトリエ","男女ペアによる文学作品を提供。後ほど編集。","ピヨヒコ　ハトヤ","http://www.toriatelier.com/","@toriatelier","小説","エンタメ・大衆小説"
"C","43","43","タビカバン","旅かばん","旅かばんは創立５年目の、詩、純文、エンタメ、書評、エッセイ、絵本、俳句、数学の問題まで、なんでもありの総合文芸誌です。それぞれの作者の得意分野で、熱意のこもった作品にあふれています。毎号、新たな分野のチャレンジも試みています。","","","","小説","エンタメ・大衆小説"
"C","44","44","コウゲツヤカン","紅月夜館","はじめまして。雇われ料理長の玄函丹舞です。私どもは福井県の端っこで、細々と営まれていた中華飯店で出会いました。あれから、五度目の金木犀の季節。店はもう亡いけれど、振るった鉄鍋の重みは各々の腕に残ってい。私どもは旗を揚げましょう。大陸的中華飯店「紅月夜館」復活の旗を！！！見ていてください、支配人。
","玄函丹舞/紅葉コウヨウ/永遠野純","","@kogetsuyakan","小説","エンタメ・大衆小説"
"C","45","45","コウモトナオタカ","甲本直孝","ジャンルの違うエンタメ小説を２冊、各１００円、Ａ５で２００頁前後。１冊は中編集で、廃部した野球部の３年生マネージャーと２年生選手の１年を追う青春もの等を収録してます。もう１冊は第１次大戦と現代それぞれで虐殺に直面する架空少数民族を描いた長編『自治区抹消』。本文を載せた紹介ペーパーも置くのでお気軽に。","","http://consider21.web.fc2.com/","@yatouwo","小説","エンタメ・大衆小説"
"C","46","46","ナナオクプリーズ","ナナオクプリーズ","スマイルプリキュア","星井七億","http://7oku.hatenablog.com/","@nnnn330","小説","エンタメ・大衆小説"
"C","47","47","ヤハンスギノユウビンヤ","夜半すぎの郵便屋","こじんまりとした個人サークルです。
現代舞台のファンタジーや群像劇などを書いております。
無料配布本も置いてありますので、手に取って頂ければ幸いです。","","","","小説","エンタメ・大衆小説"
"C","48","48","トウソウシュッパン","闘争出版","青春、ホラー等、各種ジャンルにおいて日々己の無力感と闘っています。","小岩井豊　asobico","","@yutaka_koiwai","小説","エンタメ・大衆小説"
"C","49","49","アカイミケンキュウショ","あかいみ研究所","もっとまともにブログを更新しまして作品をアップしたい気分です","","http://ch.nicovideo.jp/akaimi","","小説","エンタメ・大衆小説"
"C","50","50","キッサマリエール","喫茶マリエール","20代女子3人による小説サークルです。昨年好評だった、おとぎ話を下敷きにした短編集『Otogi Stories』第2弾が登場予定です。またカルチャー雑誌『花園magazine』の最新号も発売！　こちらは「読書特集」の予定です。","佐井識、紙野まじお、中畑まや","http://kissamaryell.wordpress.com/","","小説","エンタメ・大衆小説"
"C","51","51","カラマーゾフノイヌ","カラマーゾフの犬","#ドストエフスキー経営の居酒屋にありがちなこと　#ドストエフスキー百人一首　#ドストエフスキーセンター試験　など挫折業界最大手ドストエフスキーの世界のネタ本が中心です。","","http://ameblo.jp/merongree/","@merongree","小説","エンタメ・大衆小説"
"C","52","52","ヤカンノスゴモリ","野干の巣籠","『少女の言葉が少年の世界を変えていく。突然の雷雨の中で、物語が目をさます』
『人と人との繋がりが、まるで童話そのものだった。青年の人間関係は、童話の世界に置き換えられていた』

二つの短編が織り上げる真夏の青春ラブストーリー。

新刊【君と見わたす世界に】

－その世界には、恋がある－","野干、紅白饅頭","http://yakan-s.cocolog-nifty.com/","","小説","エンタメ・大衆小説"
"C","53","53","シキサイライター","色彩writer","色を書いて文を塗ってます。当日は連作短編集を一冊とフリーペーパーを頒布予定です。楽しく作るをモットーに、当日会場であなたをお待ちしています。","syou、橙","http://shikisaiwriter.web.fc2.com/","@shikisai_writer","小説","エンタメ・大衆小説"
"C","54","54","カサ","傘","文学フリマ初参加、北海道を拠点に活動する同人サークル「傘」です。今回は機関誌「傘と胡椒」創刊号を販売します。はじめての文フリ、はじめての同人誌ということで、テーマは「解散」。いつか別れるために結成した私たちの第一歩を、ぜひご覧ください。","阿川せんり、篠崎要、水原涼、八木沢佑","http://lalacyc.web.fc2.com/","@dorori_dorori","小説","エンタメ・大衆小説"
"C","55","55","シークレットワーク","Secret Work","高田馬場の辺境で出逢い、不毛と怠惰の二年を共に過ごし、代々木の地下にて同日果てる誓いをするわけでもなく、何となくその場の雰囲気で結成されたサークルです。当日は、毒にも薬にも暇つぶしにもならない程度の大衆小説を出す予定です。","ばだい","","@aobadai0630","小説","エンタメ・大衆小説"
"C","56","56","ソウブンドウ","ソウブンドウ","――「隠り世」への扉、開けてみませんか？
商業媒体を含め多方面で活躍中の執筆陣が「仮想空間」をテーマに競作したSFアンソロジー、『カクリヨ〈仮想空間〉で逢いましょう』を頒布します。他では味わえない迷子気分をお約束！　既刊『欠落少女コレクション』もあわせてどうぞ。","神尾アルミ、若本衣織、七木香枝、空木春宵、武田若千、enu","http://soubundou.net/","@soubundou","小説","エンタメ・大衆小説"
"C","57","57","ショクジンシャ","食人舎","前回大好評だった「文学とはＲＯＣＫである。」の新刊を頒布いたします！今回のテーマは『戦う。』ビブリオバトルや前回好評だった企画アルバムレビューを行う予定です！イラストや漫画も豊富に収録し、本作も豪華執筆陣でお送りします！詳しくはTwitterアカウント@shokujinshaまで！","かにヴぁ。　きのせい","http://canivasha.jimdo.com/","@shokujinsha","小説","エンタメ・大衆小説"
"C","58","58","カラフネ","カラフネ","メンヘラのメンヘラによる大衆向けのメンヘラコンテンツをお届けします。","","","@Q_sai_","評論","サブカルチャー"
"C","59","59","アールビーセレクション","R.B.SELECTION","その路線の歴史及び時事ネタを元に物語を紡ぐ鉄道擬人化小説。小説を書くにあたって研究を重ねた公共交通評論などもあり。地方ローカル線の哀しく可笑しな物語を今に。","","http://rbs.dojin.com/","@koumyonakakureg","小説","エンタメ・大衆小説"
"C","60","60","ニシトウキョウデンテツ","西東京電鐵","鉄道サークル。「鉄道営業」に焦点を当て、「萌える」きっぷや鉄道営業現場のフィールドワークに勤しんでいます。当日は、乗車券の臨時発売本や車内補充券の本を頒布する予定です。","","http://ameblo.jp/nishiden-toyoda/","@nishitota","ノンフィクション","その他"
"C","61","61","ユメミルモグラ","夢見ル土竜","鉄道・バス等、公共交通機関等を中心とした情報を提供するサークルです。ビッグサイトへの公共交通アクセスガイド『ありあけへのみち』や筆者が地方同人イベントへ遠征した際の旅行記『ニシエキタエ』などを発行しております。","う～たん","http://yume-miru-mogura.cocolog-nifty.com/","@UTAN0719","評論","その他"
"C","62","62","ムゲンエンテン","無限遠点","短編アンソロジー、”ミステリの絵本”最新刊を予定。
今回のテーマは、『巨大ロボット』、『悪の秘密結社』、『ヒーロー』、の三題。
古いテーマだが、古いからこそ、汲み尽くせない何かがある。","平井十一、四中、ピタジマテツエイ、ムラカミ、ききうきき","http://mugenenten.web.fc2.com/","@mugen_enten","小説","SF"
"C","63","64","トウカイエスエフノカイ","東海ＳＦの会","東海地方を中心に活動しています。
新刊は「小松左京」特集　book1.book2をセットで販売しています。","","http://homepage3.nifty.com/tokaisfnokai/","","小説","SF"
"C","65","65","イチエンコウタロウトカワチジュズ","一圓光太郎＋河内寿々","一圓光太郎と河内寿々の寄り合い。
一圓光太郎：【SF／歴史／ファンタジー／ラノベ】普段はゲーム業界で働いてるらしい。
河内寿々：【純文学】kindleでも立ち読みできます。「なすび」「星砂の浜」で検索を！","一圓光太郎,河内寿々","http://orange.zero.jp/ichien.bird/","@kawachijuzu","小説","SF"
"C","66","66","ヤコウチュウノランプ","夜光虫のランプ","＼初参加／合同サークル。異世界軍事系シリアス（R15）とハードボイルド系アクションの既刊と無配本をご用意しております。 挫折を味わった者、全てを失った者達が行き着く先は……お気軽にお立ち寄り下さい。（生真面目に書いてますが、デザートイーグル、特殊部隊、義腕と、静かに熱く「燃」えられれば幸い）","志津  高柳総一郎","http://d-nomads.sakura.ne.jp/","@wanderer_xxx","小説","SF"
"C","67","67","ワジマプロジェクト","Wajima Project","中世ヨーロッパの封建社会から産業革命になるくらいの世界を舞台としたSF小説をメインにしています。
知性とか数学とか深宇宙とかが出てくる中編、長編を書いてます。
","c--power,姫神どろっぷ","http://blog.wa-jima.net/","","小説","SF"
"C","68","68","シジョウチョウサハン","市場調査班","ＳＦを中心とした長編小説からショートショートまでを扱っている黒井謙　個人サークルです。こちらのイベントは久し振りの参加となりますが、力の籠った自信作を引っ提げて会場に乗り込・・・めたらいいですね。","黒井謙","http://pixiv.me/blk_swdmn","","小説","SF"
"D","1","1","ハルコンジッコウイインカイ","はるこん実行委員会","毎年４月に行われるＳＦイベント「はるこん」の実行委員会です。来年のはるこん2014に関するご案内の他、はるこんブックス第四弾『我は四肢の和を超えて』（ジョー・ホールドマン著、加藤直之・表紙＆本文イラスト）の頒布を行います。","","http://www.hal-con.net/","@halcon_staff","小説","SF"
"D","2","2","プロジェクトディー","Project:D","2009年7月に創作SF同人「Project:D」設立以来、丸4年が過ぎ、5年目に突入しました。SFを中心として、ファンタジー、伝奇、ショートショートなどエンターテイメント小説をご提供しています。","ほりえみつお、leemin、玲 一文、かたやま伸枝、薬袋摩耶、浅沼タミヲ","","","小説","SF"
"D","3","3","アーカイブキシダン","アーカイブ騎士団","ゾンビから、あなたへ。あなたから、ゾンビへ。仮借なきアーカイブ騎士団のときめき☆ゾンビ小説集。時はアイドル戦国時代、昼はアイドル、夜はゾンビのアイドルゾンビ小説／一億人分の記憶を持つ歴史家（宇宙人）と意識を持たないゾンビ少女の未来型ボーイミーツガール小説／他。ノーゾンビ・ノーライフ！","高田敦史、森川 真","http://d.hatena.ne.jp/at_akada/","@at_akada","小説","SF"
"D","4","4","クラタタカシ","倉田タカシ","いつものあれです。いつものどれですか？　あなたが落としたのは、この、口いっぱいに鉛の活字をほおばったシロナガスクジラのなきがらですか？　一択です。はいかYESでお答えください。あなたは正直者だから、きっとまた素直な感想を口にしてしまうでしょう。「微妙ですね」でも、そこは「激ヤバですね」などと答えてほ","","http://yukiatte.tumblr.com/","@deadpop","小説","SF"
"D","5","5","フィッシュアレイブックス","FishAlleyBooks 魚小路書房","ＳＦ短編集、ＦＴ短編集、コージーミステリー、ＮＹが舞台の警察小説などを書いています。
読んで楽しめる、心に何がしかの印象を残す作品を送り出したく思っています。","加藤海路・SKYFiSH","http://fishalleybooks.web.fc2.com/index.html","","小説","SF"
"D","6","6","アオネココウボウ","青猫工房","異世界歴史ＳＦ長編小説を細々展開中。現在１－１０巻。他に、海外で同人原稿を作り続けたエッセイなど。なお、300頁を超える文庫サイズの本は全て手作り。手作り派の方、工夫と苦労のネタ話を共有しませんか。","青猫","http://www.aonekoguild.com/","@aonekoguild","小説","SF"
"D","7","7","オオヤツリュウスケ","大谷津竜介","オリジナルSF小説の既刊・新刊を出展します。","大谷津竜介","http://ohyatsu.jp/wp/","@ohyatsu","小説","SF"
"D","8","8","カラクサギンガ","唐草銀河","WEB小説サイト『唐草銀河』（2010年10月から毎週金曜更新中）管理人。ＳＦ帝国歴史ファンタジー領ロマンス特区在住のルネサンス美術おたくです。2011年６月の文学フリマから同人活動はじました。今回で無料誌含め２０冊の本を出すことになります。どうぞ遊びにいらしてくださいね☆","磯崎愛","http://karakusaginga.blog76.fc2.com/","@isozakiai","小説","SF"
"D","9","9","シカガミ","鹿神","冥王星の軍隊を舞台にしたＳＦ小説『ＰＬＵＴＩＡ』シリーズを販売しています。
『ＰＬＵＴＩＡ　試される準惑星』（既刊）
『ＰＬＵＴＩＡ　境界の戦士』（既刊）
好評につき残部僅かです。
今回、ＰＬＵＴＩＡシリーズ新刊も発行予定です。既刊未読でも楽しめる内容です。
お気軽にお立ち寄りください。","鹿彩もす、神田春","http://plutia.konjiki.jp/index.html","","小説","SF"
"D","10","11","ユニワソウ","ゆにわ荘","主にオリジナル小説が専門の同人サークルです。","","http://yuniwasou.blog.fc2.com/","","小説","SF"
"D","12","12","ミドリムシショボウ","みどりむし書房","不屈な文学女子二人が立ち上げたサークル「みどりむし書房」です。
大人と子供の間で思い悩む男の子・女の子の短編集や、じんわり心に沁みる妖怪ファンタジー「春子ちゃん」シリーズ等あります。詩集や無料配布も有り。新刊もきっとあります。烏合の「聚」な新刊雑誌がある予定です。ぜひお立ち寄りください。
","華音・独蛇夏子","http://ameblo.jp/midorimushi-show-bow/","@midorinokanon","小説","その他"
"D","13","13","クロノデンセツ","黒の伝説","ラブクラフトの作品の和訳と散文","","","","小説","その他"
"D","14","14","フェニドラ","ふぇにどら！！","今回の新刊は、久地加夜子個人誌「老人と銃（仮）」です。また、文フリ初売りのクトゥルフ神話アンソロ３「混沌」、官能小説アンソロ「人外娘」「百合４」などなど多数あります。どのアンソロもプロアマ混合です。よろしくお願いします。","ヒガヒサ＠久地加夜子、茶葉、虚多右近、ビクター、他","http://samurai.or.tv/","@higahisa","小説","ファンタジー・幻想文学"
"D","15","15","ゲンソウカ","幻奏華","絡み合う人間模様を描いた硬派文学系やサスペンス物、ほんわかファンタジーもあったりするオリジナル小説サークル。中世・近現代の時代的な背景を素材にして、人間心理を追求する作品が多めです。","秀信澄","http://gensohka.web.fc2.com/","","小説","ファンタジー・幻想文学"
