"F","10","10","ホンバノポトヤ","本場の歩登屋","ダークファンタジをメインに、創作ライトノベルを制作しております。基本、ネット上にもほぼ同じ作品を上げておりますので、本はアナログ派の方向けの配布になります。","歩登","http://homepage2.nifty.com/potoya/Gtopka.htm","@poto0411","小説","ライトノベル"
"F","11","12","シアワセモノマニア","シアワセモノマニア","創作空想小説サークル。矛盾に満ちた魔法の世界、崩壊した地球の片隅、不思議が集う現代の特異点……大長編から短編集まで、いくつかの架空世界を舞台にした空想娯楽物語を綴ります。モットーは「幸せな人による、幸せな人のための、幸せな物語」。","青波零也","http://happymonomania.sakura.ne.jp/","@aonami","小説","ライトノベル"
"F","13","13","カエラセテクレ","帰らせてくれ","今日も茶道部に集まる四人の女子中学生。お茶とたわいのない会話、穏やかに流れていく時間。誰かが言う、「いつまでもこんな日々が続けばいいのに」「そうですわね」――実は、そうではないのだ。（という小説を出す予定です）","直泰／ちん花","http://kaerasetekure.onmitsu.jp/","@antyoku","小説","ライトノベル"
"F","14","14","クロイコウチャ","黒い紅茶","紅茶とサンリオと少女をこよなく愛する図書館員です。
主にライトノベル寄りのファンタジーを書いています。

去年頒布した「近づくな魔法少女がうつる」の、続編を出せたらいいなーという予定です！
あとなにか無料配布も。
","天竜川来良","http://tenryugawa.web.fc2.com/","@raira_t","小説","ライトノベル"
"F","15","15","リョウセイコウボウ","綾星工房","theetaの個人サークル「綾星工房」は広島からやってきました。ＳＦバイオレンス・ガーリィパンク「艤装少女社会」販売予定。性、狩猟、人体改造に満ちた下劣なる「社会」と、その支配者たる「少女」たちの軌跡を描きます。書き口は堅めですがエログロ美少女ものである旨ご承知くださいませ。","theeta","","@theeta_shh","小説","ライトノベル"
"F","16","16","フロムエックス","ふろむえっくす","禅仏教をモチーフとしたライトノベル『しょせん、この世は空と色！』のみを扱っています。仏教とか知らなくても楽しめるよう心がけていますが、どうでしょう。全７部構成を予定しており、１・２部が既刊です。今年は第３部の出来上がったところまでを用意しているはずですので、興味のある方はどうぞお立ち寄りください。","山本ゆう、長田しうくりーむ","http://fromx.m19.coreserver.jp/","","小説","ライトノベル"
"F","17","17","カンジチュウオウケイビシステム","漢字中央警備システム","ただゲームしているだけ！　偏ったゲームネタ満載のコメディライトノベル「エンディングまで病むんじゃない」その迷走する続編「EDY2」頒布！　今回もわかりにくいネタ解説書つき！　（※この本に有料DLC及び完全攻略本発売の予定はありません）","Hikezen Neu Mohd　深海花乃　こくまろ　ゴーフ・クランキー","http://www.geocities.jp/kanji_c_s_s/","@kokumaro65","小説","ライトノベル"
"F","18","18","ラックアンラック","luckunluck","第十五回で出した準備号の本編を持って行ければと思っています。既刊あります。おおむね少女向け。","蒼河ひろ","","@aohiro31","小説","ライトノベル"
"F","19","19","インプレッション","impression","ほのぼの青春ストーリーを中心に書いています。愛と涙とギャグ満載。","","","","小説","ライトノベル"
"F","20","20","ユメノアワジョシコウコウクリームソーダブ","夢ノ泡女子高校クリームソーダ部","創作アイドルユニット「夢ノ泡女子高校クリームソーダ部」は音楽をテーマにした部誌「ぼーなすとらっく♪♪」を頒布しています。ゆのっち、ゆずきゅんを中心に小説やマンガと様々な作品を掲載しています。","湯ノ浦ユウ　ゆずさ　ゆのっち　ゆずきゅん","http://yunourayou.blog.fc2.com/","@yunourayou","小説","ライトノベル"
"F","21","21","ミッシングガール","missing girl","友情以上家族未満。メンタルの弱い青年が好きです。","水野翠子　六結花","http://nanos.jp/willbe2/","","小説","ライトノベル"
"F","22","22","モザモザ","MOZA MOZA","テイストが若干大人向けの、パルプフィクション風ライトノベルを創作しているサークルです。間に合えば、魔法少女ハードボイルド“守護者たち”シリーズ前日譚『僕はたいした理由もなく君の手を握る』を頒布する予定です。間に合わなければごめんなさい。その他、既刊も用意しております。是非お立ち寄りください。","ロナルド始澤","http://www9.ocn.ne.jp/~r-shiza/","@Ronald_SHIZAWA","小説","ライトノベル"
"F","23","23","トウダイヘ","灯台へ","よろしくお願いします。","","","@l_picnic","小説","児童文学・絵本"
"F","24","24","タビネマチ","たびね町","ただいま東京◆文芸雑誌『十一月荘』新刊初売り◆コラム,小説等10本程度掲載◆第2号食と文化のサークル「鰊パイ互助会」様,第3号～「てのひら怪談」収録椎名春介氏,第4号,平安掌編猪俣樒氏参加◆次第5号,翌4月発行予定.特集「カネ」又は自由題文章,イラストご寄稿下さい◆ドウゾドナタモオイデクダサイ
","編集責任/丸本文恵・美術協力/梶原園子・こむらじゅん・ハムレットオキナワ","http://blogs.yahoo.co.jp/tabine_machi","","小説","児童文学・絵本"
"F","25","25","キュウポドウ","九ポ堂","夜にだけ開く「ツキアカリ商店街」、雲の上にある「雲乃上商店街」などの架空商店街の物語をチラシ風のハガキや、読み物ハガキにしております。なお、「九ポ」とは活字の大きさの9ポイントに由来します。祖父の残した活版印刷道具を用いて、ハガキを刷っていますので、活版印刷ならではの風合いもお楽しみください。
","酒井草平・葵","http://www.kyupodo.com","@soheisohei","小説","児童文学・絵本"
"F","26","26","オヨゲ","泳げ！","創刊14年目。創作、書評、エッセイ他、有名作家に勝手に挑戦する文学対談「知の冒険者たち」、選考のからくりを鋭く暴く「泳げ！文学賞」、文字通り命がけの「泳げ！座談会」など熱い企画頁も。文学好きにもそうでもない人にも心をこめてお届けする、涙と笑いのほぼ130頁。時代はエコ。君は泳いで北極を渡れるのか!？","押川理佐・まるたにひとみ・服部淳子・ぼのぼ・澤田ちせい・猪俣樒","http://oyogel.blog.fc2.com/","@oyogel","小説","児童文学・絵本"
"F","27","27","ニホンジドウブンガクヘンシュウブ","「日本児童文学」編集部","児童文学や童話はもちろん、子ども向けファンタジー、ミステリー、ノンフィクション、詩、童謡、さらには評論研究まで、児童文学に関わる全てにこたえる雑誌です。最新号のほか、バックナンバーも並べます。","","","","小説","児童文学・絵本"
"F","28","28","フリルフル","ふりるふる","初参加のふりるふるです。一途な恋愛から、狂気を孕んだ恋愛まで、各種様々な恋愛小説を書いています。新刊は、大好きな人と両思いになれたと思ったその時から恐怖が始まる、幸せの裏に隠れたほんのりホラーなお話の予定です。無料配布の短編集も置いてありますので、お気軽にお立ち寄りください。","橙河さゆ","http://frillfull.blog.fc2.com/","@frillfull","小説","恋愛"
"F","29","29","ロウジョウラプンツェル","籠城ラプンツェル","ちょっとカオスなものを書き続ける2人組です。よろしくお願いします。","大河さなこ、村上七銃","http://rojorapunzel.web.fc2.com/index.html","","小説","恋愛"
"F","30","30","カザハナノユメ","風花の夢","初参加です！
恋愛をベースに、ほのぼのしたものからダークなものまで、
自由気ままに書いております。
よろしくお願いします♪
","","http://pinkrabbit.oboroduki.com/","@aya34aoi13","小説","恋愛"
"F","31","31","ヤナギヤブンゲイドウ","柳屋文芸堂","目が三つ、鼻が四つ、口が十七個あって、「こんな醜い私に恋なんて出来るはずがない」とかたくなに信じている女の子が、優しくかっこ良く（もちろんエッチも上手な）男の子にしっかりと愛されて、自信を取り戻していくハートフルストーリー！","柳田のり子と律儀な仲間たち","http://yanabunn.seesaa.net/","","小説","恋愛"
"F","32","32","タマキブランド","タマキブランド","aikoは人生まったり小説書きです。メタ八犬伝・学園青春もの「八犬士にはさせないで」頒布予定。自分を八犬伝の犬塚信乃だと思いこんでいる男の子に犬江親兵衛と思いこまれ迷惑をふっかけられる女の子とその幼馴染男子とのドタバタかつ恋愛かつシリアス物語。歌詞研究本「aiko文学 解釈と鑑賞」等既刊もあります。","おきあたまき","http://tamakushige.web.fc2.com/","@tamaki_okia","小説","青春・学園"
"F","33","33","シンコシンク","Cinq synch","処女作となるビジュアルノベルゲーム「Like Lie Cry」を販売予定。Windows用のオリジナル作品です。男子大学生が主人公で恋愛要素有りですがラブコメではなくドラマ性を重視。男女問わず楽しめるよう心がけています。グロテスクな描写や性的な描写、ファンタジーの要素はありません。","","","","小説","青春・学園"
"F","34","34","ガールズクロニクル","ガールズ・クロニクル","少女たちの歴史について、小説を書いています。","","","","小説","青春・学園"
"F","35","35","ゼツボウケイセイシュンドウメイ","絶望系青春同盟","君は誰かを羨ましいと思ったこと、ない？　一年ぶりの参加。小説新刊およびサークルコピ本「WeAreRomantic5」を予定。「青い引力」義里カズ：夏祭りにすれ違う少年少女の選択。「青と黒」少色：黒ロンの色、彼女たちの色がそのままでありますように。","少色、義里カズ","http://despairyouth.blog118.fc2.com/","@aerialbright","小説","青春・学園"
"F","36","36","サンカクフラスコ","三角フラスコ","SF（すこしふしぎ）な青春ファンタジー（SF）小説が多め。　
恋愛要素は少なめ。
新刊は少年兵が主人公の血生臭い感じの話になると思います。","浅倉 和悟","","@Conical_Flask","小説","その他"
"ア","1","1","セイジョウダイガクブンゲイブヨロズヤムゲンドウ","成城大学文芸部《萬屋夢幻堂》","成城大学から飛び出して文フリ初参加。普段は年に四回、萬屋夢幻堂という季刊誌(ちょっと厚め)を発行していますが、今回はイベント増刊号を作って持っていく予定です。一万字以内で描くファンタジー特集！どうぞお立ち寄りください！","","http://yorozuyamugendo.jimdo.com/","@y_mugendo","小説","アンソロジー"
"ア","2","2","フヅクエ","文机","オリジナル文芸サークルです。「世界観の構築を主眼にして書く」「一万文字丁度で書く」などの企画に沿って書かれた短編を集めたアンソロジー文芸誌『コトダマ』を発行しています。ライトノベルではありませんが、暗すぎず、重すぎず、楽しく読みごたえのある小説が揃っています。","想 詩拓、リープ、山極由磨、ごはんライス、若月一也","http://mypage.syosetu.com/124296/","@sou_sitaku","小説","アンソロジー"
"ア","3","3","キリサメリョウジュウニゴウトウ","霧雨寮12号棟","9人の執筆者によるアンソロジー
執筆者に与えられたルールは三つ。
一、文字数一万文字以内
二、テーマ・ジャンルフリー
三、エログロなし
小説好きの当霧雨寮、寮生の渾身の創作短編集。","","http://halocline.mods.jp/kirisame_main.html","@kirisame_12gou","小説","アンソロジー"
"ア","4","4","ギフト","GIFT","早稲田大学の人間科学部、文化構想学部を中心にした文芸サークルです。小説を書く人、イラストを描く人、さまざまいて、年に2回SkyWalkという機関誌を発行しています。他にも、サークル員が自由に企画を立てて、リレー小説やリクエストされたテーマで創作するリクエスト本などの企画本を定期的に発行します。","","","","小説","アンソロジー"
"ア","5","5","ハハノロ","ははのろ","母子関係にまつわる憎しみと愛を、思い思いのやり方で思い思いに吐き出している存在そのものが業深い同人誌「母子関係は呪いアンソロジー」、頒布いたします。","","","@_mao_s","小説","アンソロジー"
"ア","6","6","ジョリュウブンゲイサークルテットウ","女流文芸サークル【鉄塔】","また懲りずにへんな進化を遂げてしまった女たちです","","http://tettou.kirisute-gomen.com/","@tettou_denpa","小説","アンソロジー"
"ア","7","8","スイヨウブンゲイシャ","水曜文藝舎","御茶ノ水を拠点に据え、日々の鍛錬に明け暮れながら、それぞれが夢を追い求めるうち、自然の摂理にしたがって結晶化した、弱冠文士による文芸集団。小説はライトノベルから純文学、詩歌やその他文芸、雑多に取り揃えてあります。","","","","小説","アンソロジー"
"ア","9","9","ヨコハマシリツダイガクブンゲイブ","横浜市立大学文芸部","横浜市立大学文芸部は、ジャンルを問わず創作活動を幅広く行っています。小説でも恋愛小説からラノベ、ファンタジー、架空戦記物、他にも詩や短歌などなど、多彩な作家が揃う部活です。今回は2年生が中心となって作った新刊アンソロジーが出ます。","","http://ycu-books.net/","@YCU_bungeibu","小説","アンソロジー"
"ア","10","10","ブンアイ","ＢＵＮ−ＡＩ","一年ぶりの参加！前回は怖い話ありましたが今回は…？お楽しみに！","","","","小説","アンソロジー"
"ア","11","11","カイギョウモデキナイブンゲイブ","改行もできない文芸部","疲れた社会人の疲れた社会人による疲れた社会人のための文芸活動を行っています。素敵な一期一会を期待して一同ブースでお待ちしています。","社会人数名","","","小説","アンソロジー"
"ア","12","12","ハメツハ","破滅派","後ろ向きのまま前へ進め！　低回趣味を掲げるオンライン文芸誌です。","","http://hametuha.com","@hametuha","小説","アンソロジー"
"ア","13","13","ムサシノダイガクブンガクケンキュウブ","武蔵野大学 文学研究部","私たち、武蔵野大学 文学研究部は総勢50人を超す部活動です。週１回の部会や不定期開催の講習会・読書会を通じ、それぞれの文学への意識を高めています。文芸ジャンルは小説に限らず、現代詩、俳句、短歌なども扱っています。見本誌も用意していますので、ぜひお立ち寄りください。","","http://book.geocities.jp/bunken_net","","小説","アンソロジー"
"ア","14","14","カフェドリッテラ","Cafe de Littera","作家と読者がお茶を飲みつつ語り合うために生まれた＜Cafe de Littera＞（通称：文学カフェ）。第二号は『和』。甘い作品、苦い作品、各種取り揃え、御来店をお待ちしております。","","","@bungakucafe","小説","アンソロジー"
"ア","15","15","ネコマタカイ","ねこまた会","それぞれが描きたいことを書き、集めた冊子「ねこまた」を発行いたします。
あっさり読みやすいものから、しっかり読み応えのあるものまで、それぞれの個性を存分に発揮して書きました。
ぜひともブースにお立ち寄りいただき、お手に取ってご覧くださいませ。","","http://neko2party.web.fc2.com/","","小説","アンソロジー"
"ア","16","16","ブンゲイサークルツヅリ","文藝サークル〜綴〜","オリジナル短編作品集「綴」は、毎回テーマを設定して、そのテーマに沿った短編を書いています。ラノベ系の作品もあれば、純文学系、また読み物系等々、ごった煮の文芸誌になっています。新刊「綴Vol.13」のテーマは「スイッチ」と「境界」。さらには長歌や詩など、ラインナップも充実してます！","縁側童子　KISARAGI　今田ずんばあらず　西谷黯　小桃龍　末永幸　人人　他","http://tudurin.web.fc2.com/","@Circle_TuDuRi","小説","アンソロジー"
"ア","17","17","サイタマダイガクレーゼツァイヒェン","埼玉大学 Lesezeichen","埼玉大学文芸部のレーゼツァイヒェンです。年四回の会誌の定期発行と、学祭・文フリのための特別版のお披露目。部員の多彩な個性をお楽しみください。","","http://lesezeichen09.blog66.fc2.com/","","小説","アンソロジー"
"ア","18","18","ガクセイキブン","學生氣分","今号は「リメイクアンソロジー」をお届けします。作者不詳の物語をベースにして新作小説を書くことを書き手に課しました。","健信院正法 橘圭章 子路 三路霜高 他","","@gakusei_kibun","小説","アンソロジー"
"ア","19","19","チャノマン","ちゃのまん","お茶の間文芸誌「ちゃのまん vol.2」（500円）を配布致します。伊川拓人、大久保ニュー、熊田プウ助、たけばやしかよこ、ドルショック竹下、ひんやりデブ、mihoco、山田参助（敬称略50音順）ほか、豪華な執筆陣をお迎えしております。少部数ですのでお早めにどうぞ。","","","","小説","アンソロジー"
"ア","20","20","ミホコ","mihoco","「DJの彼氏がいる、下北沢の古着屋で働く女の半生」というマンガと、あともうひとつマンガを出します。もし時間があれば、沢木耕太郎「深夜特急」に関するちょっとした本も出せたらいいなと思っています。","","","","評論","サブカルチャー"
"ア","21","21","プリズムモーン","PRISM MORN","絵描きの羽戸らみ（RAMI）嬢と文章書きの朝来みゆかのコラボで生まれた聖クララ女学園シリーズ。憧れや友情、少女たちの日常。ミッション系女子校を舞台にした小説をお届けします。この秋の新刊有。","朝来みゆか","http://miyuka.m78.com/","@miyukaasago","小説","百合"
"ア","22","22","ノップマット","ノップマット","“百合”と言っていいのかわからない、たぶん呼べない。ひねくれた女子同士の、一筋縄ではいかない、甘くない関係を好んで書いています。
既刊はビッチ女子×売春女子、ビッチ×サークラ女子、女子校オリジナルバトロワ小説など。","玉木サナ","http://nopmat.blog.fc2.com/","@juliet_n_z","小説","百合"
"ア","23","23","シェオル","SHEOL","オリジナル百合小説。その他、魔法少女まどか☆マギカ、おりこ☆マギカ、かずみ☆マギカの2次創作小説も。詳しくはPixivで。","nui","http://www.pixiv.net/member.php?id=1532627","@nujico","小説","百合"
"ア","24","24","フジマシオンドットコム","藤間紫苑.com","LGBTレズビアンカップルの妊活を描いた『ゆりにん』（文　藤間紫苑・絵　江川広実）、制服百合アンソロジー『征服の乙女』、ドリンク擬人化『伊藤君と円先輩』を頒布しています。","藤間紫苑　江川広実　築山尚美　二色","http://www.fujimashion.com/","@fujima77","小説","百合"
"ア","25","25","クロムラサキ","黒紫","オリジナル百合小説を書き始めて早幾年。
ようやく一つの区切りを迎えた「存在理由」シリーズ。今までとは一線を画すデザイン・イラストの表紙で好評頒布中。完売した既刊の話はネットにて公開中です。

ちなみに最終話ではありません。百合話はまだまだ続きますよ。","虹月映","http://mypage.syosetu.com/347587/","","小説","百合"
"ア","26","26","ユリーカショボウ","ゆり〜か書房","『百合＝美×少女・二乗（y=bg^2）』美しくも妖しい百合少女たちの深淵を、あなたも覗いてみませんか？◎完全オリジナル百合少女小説の他、詩集、コミック、イラスト…など創作。純愛から幻想まで幅広く。No Yuri, No Life!（二次創作は有りません）主宰：瀧口紗姫","Kurokiti、他","http://eureka.edition.jp","@saki_22","小説","百合"
"ア","27","27","ブラボ","蕪研究所","花になりたい女の子を主人公にした百合小説を予定しています。
その他、うつの吸血鬼の話など。こちらもゆるりと百合です。
","ONO","http://bulabo.blog.fc2.com/","@t_ONO_w","小説","百合"
"ア","28","28","パンオラマヒャッキエン","パノラマ百季園","随筆風や書簡体のBL小説を書くのが好きです。
どうかお恵み（ご一読）を……","嘉山秀一","","@kayama_tomorrow","小説","BL"
"ア","29","29","タンビハルーム","耽美派ＲＯＯＭ","大人女子達のちょっとエッチな雑談風ストーリー。アラサーアラフォー女達が恋に仕事に
活力全開で赤裸々トークを繰り広げます！？（基本フィクションですが、実体験もちらほら混じる…かも？）


","","","","小説","その他"
"ア","30","30","ヤマトユキハラ","大和雪原","青春であったり、人生であったりするものの舞台が単に戦場であったというだけ――。
そんな小説を書いております。
戦闘メインでもなく、腐ってもおりませんが、甘さは控えめ。流血も死も転がってます。
当日は桜花シリーズ最新刊「終戦編」があります。よろしかったらどうぞ！","","http://yamatoyukihara.web.fc2.com/index.html","@kamikaze0shiki","小説","その他"
"ア","31","31","ファジイダイアログ","fuzzy dialogue","あなたが何を言っているのかわからない。けれど、あなたが何を言いたいのかはわかる。","斉島明","","@fuzzkey","小説","その他"
"ア","32","32","ムラサキイロノフタゴ","むらさきいろの双子","小説を言葉を詩を詞を、声にする。音にする。切り取る。動かす。
何のために？　私たちのために。
ＤＶＤ販売もしくは、写真集販売。（8月現在）
今期テーマ：東京の文学","むらさきいろの双子＝ひだりのあお　さりい＋みぎのあか　とみい","http://ameblo.jp/lilasterchen/","@futago_iro","小説","その他"
"ア","33","34","セサミスペース","セサミスペース","テキスト、写真、コラージュ、ドローイング、ビデオ、インスタレーションなどの作品、ZINEなどを作っています。","セサミスペース","http://www.sesamespace.net/","@sesamespace","小説","その他"
"ア","35","35","ニショウガクシャダイガクブンガクシソウケンキュウカイアンドヤマグチタダヨシゼミ","二松学舎大学ぶんしけん＆山口直孝ゼミ","二松学舎大学に所属しているサークル、文学・思想研究会です。普段は学内で読書会・勉強会を行っているのですが、この度、おもに小説と映画を対象として、100作品をレビューした本を制作しました。山口ゼミはゼミ誌『解纜』をバックナンバーを中心に販売します。特集は大西巨人の作品と探偵小説を主に取り上げます。","","https://sites.google.com/site/dlinishogakusha/","@dli_nisho","小説","その他"
"ア","36","36","ニショウガクシャダイガクブンゲイアイコウカイ","二松学舎大学文芸愛好会","部誌『陽と波』や『二松維新』などの販売・配布を行います。
「我々が文章を書く所以は各々によって異なる。故に、この雑誌は自ずと純文芸誌とは異なる。各自の文章ひいてはこの一編の雑誌が、自己の記念碑となりもすれば、また他者が何らかの意を見いだすことがあれば幸いである」（『陽と波』巻頭言より抜粋）","","http://aikoukai.blog.shinobi.jp/","@bungei_bot01","小説","その他"
