"Japanese, UTF-8, CRLF, Comma-separated Values (CSV) (See RFC4180)."
"ブース記号","ブース番号始","ブース番号終","サークル名(カナ)","サークル名","告知文","メンバー","Webサイト","Twitter","大カテゴリ","小カテゴリ"
"A","1","2","ホウセイブンゲイ","法政文芸","法政大学文学部日本文学科で編集している文芸誌です。","","http://hoseibungei.web.fc2.com/","@hoseibungei","小説","純文学"
"A","3","3","イヌオシュンヨウ","犬尾春陽","小説と、喫茶店紹介記事や音楽紹介記事を書いています。
今回は既刊小説冊子「月夜」「領域」「ワルツ」「乙女椿の咲く季節」「窓辺作品集１～３」に加え、新刊も準備予定です。

日常から踏み外した非日常の景色を読みたい方に。","","http://sanguria.exblog.jp/","@s_inuo","小説","純文学"
"A","4","4","インサイドアウト","InsideOut","『InsideOut』は無料の投稿雑誌です。誰でも描き手に、いつでも読み手になり得る。ジャンルという垣根を越えて表現が伝播し、イメージがイメージを産み出す。
そのときの混然とした空気の力こそが、きっと「ホント」で、面白い。","川端康史、本多篤史、ミツイタカヒロ、わくりはるの、坂井多果、中村叶子","http://www.letsinsideout.com","@InsideOut_Free","小説","純文学"
"A","5","5","ブンガクケッシャネコ","文学結社猫","文学結社猫は猫の主宰する文学結社。イムルダイストの山本清風による戯作小説を発行。新刊は「ミソジニー容認による男受けからのビッチ承認少女とクソサブカルナイーブ野郎の果てもなき殺しあいの小説」を予定。合作企画の『少年憧結社猫』も。これは社会の不条理を考えすぎて真っ白になった脳で書かれた、やさしい不条理。","山本清風","http://ameblo.jp/rehabilog/","@ankipan","小説","純文学"
"A","6","6","モトカノヲゴヤク","元カノを誤訳(旧：童チョコ)","童チョコから元カノを誤訳に名前は変わりましたが日々に変化はなく、目が覚めて新しい一日が始まっていて、退屈でなぜかイライラして、それは刺激的な出来事がないせいだと思ったくせに、生きててよかったと思う夜もあるのだから、小説を書くしかないのかもしれないと逃げています。多分、それはきっと、永遠に。","伊藤佑弥","http://d.hatena.ne.jp/cm-journey/","@motokano_goyaku","小説","純文学"
"A","7","7","シンセン","シンセン。","初参加です。恐らく純文学らしきものを持って行くつもりです。本をつくったことがないのでどのようなものができるか想像できませんが、テーマは大抵「愛」だと思われます。お値段はお安めのはずです。","小辰みなひと","http://overtheelevenpm.web.fc2.com/","@37110k","小説","純文学"
"A","8","8","ファミリーファンドユニット","ファミリーファンド・ユニット","とりあえず本を作ってみたくて、参加してみてどうなるのか分かりませんが、何かあるのかもしれないと思って小説とエッセイを書いたので、読んでほしいです。","","http://familyfundunit.blog.fc2.com/","","小説","純文学"
"A","9","9","ハナモリユキメ","花森ゆきめ","ないしょ話のような作品を作っています。
人差し指を唇にあてて
とんでもなく遠くまで伸びる糸電話で伝えるように書いています。
小さな言葉たちです、よければ耳を傾けにいらしてください。
お待ちしています。","","http://members3.jcom.home.ne.jp/kissxxxx/","@clumsy_wink","小説","純文学"
"A","10","10","キョウトジャンクション","京都ジャンクション","京都で出会った20代による文芸サークル。
今回の文学フリマでは１年ぶりの第４作品集を発行する予定です。
","智東与志文・高瀬遊・安樹茂里・濱松哲朗・松村ショータ・大鴉こう","http://kyotojct.net/","@kyotojct","小説","純文学"
"A","11","11","ダレニモワカラナイ","だれにもわからない。","前作『Lollypop Rainbow』に引き続き、今回はゲストを迎え、新刊『僕らのすーぱーいんたーねっと』を頒布する予定です。純文学の系譜にポップで軽快な線を引くように星座的短編を布置していきたいと思っています。立ち読み歓迎ですので、是非気軽にお立ち寄りください！可愛い表紙でお待ちしてます！","四流色夜空、葛西心中、矢窪秋、斉藤慶次、桂万智、Ｋ坂ひえき、練々子、まここ　他","http://yozora.hatenablog.com/","@yorui_yozora","小説","純文学"
"A","12","12","ドウシシャブンゲイドウコウカイ","同志社文芸同好会","同志社大学の文芸サークルです。主に創作や読書会などを行なっています。
課題本について各自の思ったことを語らう『読書会』と、部員が執筆してきた作品について感想、批評を言い合う『批評会』を軸にして活動しております！","","http://yukari.koborezakura.com/","@DbungeiD","小説","純文学"
"A","13","13","トウキョウダイガクブンガクケンキュウカイ","東京大学文学研究会","今回で４回目の参加になります。詩歌、小説、評論と、古今東西の文学作品から汲み取った言葉達を機関紙『駒場文学』に注ぎ込みます。文章の趣も多種多様、貴方の琴線に触れる一篇が見つかるはずです。最新号及びバックナンバーを販売しておりますので、是非お立ち寄りください。","","http://blog.livedoor.jp/bunken_u_tokyo/","@toudai_bunken","小説","純文学"
"A","14","14","シンカイノキオク","深海の記憶","初参加です、よろしくお願いします！短編集を出す予定なので、お気軽に遊びに来てくださいませ。ツイッターやHPも、始めたばかりですがよろしくお願いします☆","秋月千津子","http://akizukichizuko.web.fc2.com/","@akizuki_chizuko","小説","純文学"
"A","15","15","コバヤシアオイ","小林青ヰ","小林青ヰが書く小説や小説的な何かや詩をおっぴろげています。
限りなくぼっちで最悪にぼっちなぼっち的創作、
あるいは誰でもある誰にでもある誰にでもなれる創作を生産中。
目下迷走中。","小林青ヰ","https://sites.google.com/site/hikarabiru/","@hirutalk","小説","純文学"
"A","16","16","ダウンワード","Downword","新シリーズ”百花譜”及び、杉山葱子句集を刊行予定","あまの こう、杉山葱子","","","小説","純文学"
"A","17","17","オオイガモリブンコ","大井ヶ森文庫","八ヶ岳南麓に居を置き、純文学小説を中心とした冊子を定期的に発刊します。
大阪大会のとき初参加、今回２回目の参加です。","","","","小説","純文学"
"A","18","18","ショウネンドウケイシャ","少年憧憬社","東京都江戸川区川町から神奈川県横須賀市水野町へ。「幻想」と「虚無」を同時に見据える現実可能性を持つ「少年性」をテーマとする文芸社“少年憧憬社”は時空も場所も哲学も超えて管を巻き続ける。既刊「花泥棒と秘密の猿たち」「川町奇譚」ほか全て新刊。","栗山真太朗","http://gold-dust-digging.blogspot.jp/","@kuriyama1youth","小説","純文学"
"A","19","19","ハナミズキ","花瑞木","高校の文芸部のメンバーが6年ぶりに再結集！今回はメンバーがそれぞれ1冊ずつ小さな本を作ります。純文学やファンタジーなど全員ジャンルが違うので、好きなものを1冊選んでも、全部まとめて読んでも楽しめるかと思います。当日はあらすじを無料配布！是非お立ち寄りください！他、個人の作品集など持っていく予定です。","花瑞木の会","http://webmizukibungei04.blog.fc2.com/","","小説","純文学"
"A","20","20","チームフォーティー","チーム40","新刊は短編『初秋の年の日記』を予定。既刊は2種。高校生一年生の少年が自転車で富士山を目指す短編『その夏』。若い女性会社員の恋のような物語と、女子大学生の恋愛を描いた2編を収めた『日々是空色』。","","","","小説","純文学"
"A","21","21","ストカスト","ストカスト","文フリでは明るく頑張っていましたが、私にとって一番孤独な時間でした。でも15万票というすごい票数を見て、私は孤独じゃないんだと感じることができました。投票してくださったみなさん、本当にありがとうございます。私がセンターになると文フリは壊れると言われるけど、絶対に文フリを壊しません！頑張ります！
 ","木嶋章夫","","@miltonxmilton","小説","純文学"
"A","22","22","セイジョウダイガクブンガクケンキュウカイ","成城大学文学研究会","私たちは成城大学の文学研究会です。書評や自由投稿中心の機関誌『雪月花』を
発行しています。ぜひブースに御越しください！","","http://seijo-bunken.jugem.jp/","@bunkenn","小説","純文学"
"A","23","23","ケイオウペンクラブ","慶應ペンクラブ","慶應ペンクラブは、慶應義塾大学内で活動する文芸サークルです。秋に発行した部誌を中心に学生が書いた小説を販売しております。今回が7回目の参加になります。お気軽にお立ち寄りください。","","http://keiopenclub.web.fc2.com/","@keiopenclub","小説","純文学"
"A","24","24","ヒロサキダイガクブンゲイブアダリーノジャイゴ","弘前大学文芸部アダリーノ・ジャイゴ","津軽海峡から泳いでやって来ました。文芸部の有志が小説を中心とした作品集を販売する予定です。今回がはじめての参加ですが、どうぞお気軽に立ち寄ってください。
","弘前大学文芸部有志","http://hirodaibungei.web.fc2.com/","@hirodaibungei","小説","純文学"
"A","25","25","アルベニカ","albenica","個人誌。小説とエッセイ。人と関わると、時に心を揺り動かされ、深く考え込まされる。そのような瞬間瞬間の感動や傷を、深く吟味し、誇張のない自然な文章で表現できればと思いながら執筆しています。","","","@albenica_bungei","小説","純文学"
"A","26","26","カオスカオスブックス","カオスカオスブックス","此処はまがいものの街、真実たるものはひとつとしてない―幻想の街に辿り着いた〈わたし〉と畸形の鳥と詩人らを描く『樹木たち』。そして凄腕記者ハサミが社会と己とクソ・クリエイティヴとをディスりまくる『アバカス』。２作を引っ下げてあのカオスカオスブックスが帰ってきた！　濃厚な混沌世界をどうぞご堪能あれ。","富永夏海　北村みなみ　古川真矢　島村圭之","http://chaoschaosbooks.tumblr.com/","","小説","純文学"
"A","27","27","ラウシズム","Lousism","矮小な生物が叫ぶことに意味があると思います。
耳の穴に忍び込んで鼓膜を食い破るぐらいの叫びを。
あわよくば振動が脳味噌を腐らせることを祈って。
Lousismは「虱主義」という意味ですが、特に意味はありません。","","","","小説","純文学"
"A","28","28","ソウゴウブカドウジンシソ","総合文化同人誌『遡』","純文学を中心に活動しています。小説・詩・短歌・評論・音楽レビュー・戯曲など。既刊の他に構成員個人誌の読み切り、短編や掌編ポストカードなどもございますので、どうぞお気軽にお越し下さい。","伊田康平　関圭介　吉田群青　昏林果奈","http://saunabrook.nobody.jp/","@sauna_brook","小説","純文学"
"A","29","29","オウミマイコ","近江舞子","新刊『秘密』を頒布します。表題作の「秘密」は近江舞子の処女作であり、初期衝動をぶつけた作品です。六年前、死にたい、死のう、長々と生きていてはいけないのだと思っていました。そして、ある作品に出会い、死ぬ前に、死ぬる覚悟で小説を残しておきたいと願い始めました。それから少しして、手探りで書きました。","近江舞子","http://d.hatena.ne.jp/oumi_maico/","@OUMI_MAICO","小説","純文学"
"A","30","30","クロイヌ","KUROINU","ごった煮","","","","小説","純文学"
"A","31","31","コールバイターズ","Coal Biters","小説「予告」刊行。あの、黒く、平べったく、夜台所の後ろなどをカサカサと走り回る、名を秘す例のいきものについて、うっかり深い考察に立ち至ったために奇怪な出来事に巻き込まれる男の話です。","","http://d.hatena.ne.jp/coalbiters/","","小説","純文学"
"A","32","32","ワセダブンゲイカイ","早稲田文芸会","早稲田大学の文芸サークル、早稲田文芸会です。純文学系その他の作品集を販売致します。","","","","小説","純文学"
"A","33","33","メルキドシュッパン","メルキド出版","最新刊『メルキド９号』「大虚構」映研メタフィクション。「打ち出の小槌研究室」実験小説。「後藤明生の子供たち」文芸評論。「サルトルと埴谷雄高」哲学エッセイ。映画時評。ほかにも進行中の作品あり。バックナンバーとコピー誌もあります。","松原のりじ、松原義浩、西井禎士郎、盛武蘭緒、渡辺昇、龍田茂雄、Ｇｏｒｏ","https://sites.google.com/site/merukidoshuppan/","@moriburansho5","小説","純文学"
"A","34","34","ハイバーネイション","hibernation","『錨と影』『１１短編集１』『１１短編集２』『１１短編集３』他","","http://flavors.me/kirik","","小説","純文学"
"A","35","35","ギンザセン","銀座線","NHK文化センター青山教室の元「小説作法」講座出身者で構成する同人誌です。今年で創刊18年を迎え、同教室講師の芥川賞作家笠原淳先生のご指導のもと、研鑽を積んでいます。
少しずつですが名前も覚えていただけるようになりました。今回は今年初めに作った最新号の18号を販売します。よろしくお願いします。","石原惠子・河井友大・沢かな・鷹宮さより・藤咲文・蒔田時春・宮本史郎・矢口樹他","","","小説","純文学"
"A","36","36","ワセダブンガクヘンシュウシツ","早稲田文学編集室","文フリ年長組の文芸誌「早稲田文学」のブースです。小説家・批評家による小冊子、ここでしか読めない書き下ろしペーパーなどを企画中。バックナンバーから新刊までを特別価格で販売！　フリーペーパー「WB」も配布します。","","http://www.bungaku.net/wasebun/","@wasedabungaku","小説","純文学"
"B","1","1","オオサカブンコ","大坂文庫","「帰宅したら弟がニート」作家10人が参加したアンソロジー。
「忍嚆矢」　　　　　　　忍者小説短編集。を新刊として頒布予定。
約一年と短期間で解散した「かげわに」の「珠紫」も頒布します。","上住断靱","http://ameblo.jp/y-takata/","@uwazumi","小説","純文学"
"B","2","2","ロル","LOL（ろる）","ローテンション・ハイクオリティな文藝同人誌です。編集代表がこいつは変だと見込んだ方にお願いした変な小説と、くだらない企画、コラム、戯曲などが載っています。","","http://lollollol.exblog.jp/","@hidekiyashiro","小説","純文学"
"B","3","3","ブンゲイドウジンスナノカイ","文芸同人「砂」の会","本誌は、今や絶滅危惧種となった、いわゆる純文学を主体とした文芸同人誌ですが、売っているのはサブカル本がメインです。新刊「serial experiments lain論」など。","","","","小説","純文学"
"B","4","4","ブンゲイドウシカイ","文芸同志会","素人から玄人の領域へ。出品誌「なぜ文学は人生に役立つのか」「外狩雅巳の世界ガイド」雑誌「雑木林」（安芸宏子）、「グループ桂」（長嶋公栄）など。","伊藤昭一、山川豊太郎、外狩雅巳、安芸宏子ほか。","http://blog.livedoor.jp/hbk3253/archives/cat_10032113.html","","評論","文芸批評"
"B","5","6","スイマーズ","スイマーズ","“ウォータークラウンが見えるくらいの目の速さでものを見る。”
　美術大学学生による小説誌、全9編を収録。","佐藤芙有　山川夜高　松尾愛　稲生梓　...","http://minasoco.jimdo.com/","@swim_book","小説","純文学"
"B","7","7","トウヨウジン","逃羊人","人造人格を標榜ないし僭称してきた筆者がでは人造とは何かを問い直すという妙に象徴的というか自己言及的というかそんな感じの作品が出ていると思う。","解場繭砥","http://kaibamayuto.seesaa.net/","@kaibamayuto","小説","純文学"
"B","8","8","ムゲンドウ","夢幻堂","おもに少年、少年性をテーマの軸とした長短編を書いています（児童文学ではありません）。昭和ノスタルジーも好みです。
純文学のカテゴリーを選択しましたが、読んで面白いもの、背後のテーマなどはともかく、国語がそこそこの高校生くらいでも十分読めるわかりやすい文体、文章を心がけています。","とりさん","http://gendamicin.blog.fc2.com/","","小説","純文学"
"B","9","9","ネコファン","NECOfan","純文学サークル「おおきなかぶ」にて小説／短歌、青林工藝舎「アックス」や同人誌にてマンガを発表する甘茶茂。2013年4月発行の『線と情事 創刊号』は、石原ユキオ／しまおまほ／島田虎之介らが参加し、コミックナタリー等で取り上げられ話題に。今回はひとり雑誌 NECOfan Magazine 増刊号を頒布。","甘茶茂","http://NECOfan.com","@keitakatsumata","小説","純文学"
"B","10","10","オオキナカブ","おおきなかぶ","「面白い本だ。即座に理解して読んだら実際その通りだった」（文学フリマ非公式ブックガイド）
「純文学と現代裏社会の不思議な融合を成功させてる」（シカクの本#001）
前作も好評価！「エキセントリックだけど本格派な短編小説集」
すべての好事家の皆様へ。","DJ Yudetaro, 甘茶茂","http://turnip.jp","@turnip_jp","小説","純文学"
"B","11","11","カエッテキタアオイハナ","帰ってきた青い花","大学の文芸サークルのOGが集まって、文庫サイズの冊子を作っています。
年に数冊、不定期での発行です。
オリジナルの小説本です。","","","@aoihana0203","小説","純文学"
"B","12","12","サラサブンコ","更紗文庫","更紗です。普段は絵を描く人です。

イラストと言葉を合わせた本をつくりました。
本当のことを正直に絵にしていくように、言葉も同じように紡いでいきたいです。

雑貨販売もありますのでお楽しみに◎","","http://matsuosarasa.weebly.com/","@matsuo_sarasa","小説","純文学"
"B","13","13","バイオレントビデオインフォ","VIOLENT VIDEO INFO","郷愁の90年代。アンファンテリブル「安東洪児」とその鏡像たる最強の敗北者「西村彦次」は2000年の伝説的『＠ルーザー』において呪われた生を開始した。『セックスマシーンと敗北者』『文化祭大革命』『学徒出陣』と辿られるサーガの軌跡はA・ランボーの砂漠の放浪のように甘美に苦い。（文芸座標/久保田輝）","安東洪児","http://m4oism.org/xxx","@kj_ando","小説","純文学"
"B","14","14","ショウジョジゴクダイキュウカイソウ","少女地獄第九階層","素敵な言葉で
一緒に狂いましょう
一緒に病みましょう
","風合文吾 奈秤大英 七谷はるか 森久里 呪田獺祭","http://showjobungaku.blog.fc2.com/","@sk_toki","小説","純文学"
"B","15","15","ヴィリジアンヴィガン","ヴィリジアン・ヴィガン","私小説的なものにラノベ要素をふりかけた作品を持って行く予定です。

私小説作家・嘉村礒多に憧れています。
大塚英志や佐藤友哉が好きな人はお話だけでもぜひ。","中西祐介","","@Naka24Viridian","小説","純文学"
"B","16","16","ツウカクプラスウィルヘルミナ","痛覚＋Wilhelmina","【痛覚】男なんて、あなたに比べたら－名付けられない関係の少女たちを描いた連作『ロータス』【Wilhelmina】新刊はビートルズの楽曲をテーマにした三人誌！豪華ゲストをお招きした「神父」アンソロジー『Kyrie eleison』もあります","柳川麻衣　犬塚暁　穂崎円","http://words-in-pain.hacca.jp/pain","@asa_co","小説","純文学"
"B","17","17","キカンカレペンギン","季刊 枯片吟","小説。純文学。性懲りも無く、三度目の出店となりました。あたたかい気持ちでよろしくお願いします。","","","@karekinada","小説","純文学"
"B","18","18","ハトブンコ","ハト文庫","公園にまつわる連作小説ほか、同人による創作を、自作の和綴じ本にて頒布します。","川上詠一ほか","","","小説","純文学"
"B","19","20","ヒゴウクミアイ","非業組合","非業組合とはプロレタリア文学、日本浪漫派、戦後文学に至る線に、欧州ロマン主義の果てで内／外在するヌーボーロマンの線を併走／交錯させる不作である。これにより、サルトル的主観的実存や態度の格好良さ自慢を限界するポストモダニズムに拘泥しつつ、幾何と混沌が同格する主体亡き客観的実存を恥ずかしくも晒す。","非業組合　仄々斎不吉　シーザー","http://www.ab.auone-net.jp/~kohyo-0/higou/higoutop.html","","小説","純文学"
"B","21","21","サンジュウゴド","35℃","文學界を彷彿とさせる文体で、この世のものであるような、ないような、
曖昧な世界のお話を書いています。

文学フリマ非公式ガイドブック小説ガイドの第３版に、
拙作「天使の標本」を紹介していただいています。

それも含めた既刊はもちろん、新刊も発行予定です。
是非お立ち寄りください！","恣意セシル","http://albus.hanagumori.com/","@c_cecile","小説","純文学"
"B","22","22","ハエギワ","生え際","現状維持では後退するばかりである。","","","@hae_giwa","小説","純文学"
"B","23","23","リリーダーズ","Re-Readers","毎回、ひとりの作家をモティーフに、メンバーそれぞれが小説・評論・詩歌などを手がけています。「村上春樹」「宮沢賢治」「よしもとばなな」に続く第４回目のモティーフは、「きゃりーぱみゅぱみゅ」。誰かではないあなたに捧げる『カモノハシ通信』。今回もどうぞよろしくお願いします。Let's世界征服。","","http://d.hatena.ne.jp/kamonohashi_bgst/20120318/1332035920","@kamo_bgst","小説","純文学"
"B","24","24","ムゲンアルカナイト","無限アルカナイト","昨年に引き続き、2回目の参加になります。前回は２人のみでの執筆でしたが今年はニューカマーが加わりました。短編小説、詩、散文などをメインに執筆しています。","","","","小説","純文学"
"B","25","25","ブンゲイシュミブ","文藝趣味部","同人誌『文藝趣味部』第2号を刊行します。今回はお題に沿った短編を数作品と、各自で中編を1作ずつ掲載予定です。現在部員二名で活動中。","谷、新","http://home.catv.ne.jp/pp/hobby/","@shumibu","小説","純文学"
"B","26","26","アシカビノカイ","「葦牙」の会","社会と歴史に正面から立ち向かい、新しい<自主と共同>をめざす文学と思想のグループ。創作、社会・文芸評論、随想、書評からなる『葦牙』（年刊）と「葦牙ジャーナル」（隔月刊）の発行、および読書会を中心とした活動を30年間以上継続。","山根献、武藤功、牧梶郎、尾張はじめ、然雄、中川璃々、柘植由紀美","","","小説","純文学"
"B","27","27","ゲッポウヤ","月砲屋","オリジナル純文学小説
『スメルズライクシンデルスピリット』
ある日、自分の住まいの扉に巨大な蛾が止まっていた主人公は、助っ人として昔の女を呼び出して……？　ダメダメ人間たちが織りなす青春グラフィティ。

新刊があるかもしれません。","","http://geppoya.blogspot.jp/","","小説","純文学"
